title,year,genre,rating,duration,description
Inception,2010,"Action, Sci-Fi",8.8,148,A thief who steals corporate secrets through dream-sharing technology is given the inverse task of planting an idea.
The Godfather,1972,"Crime, Drama",9.2,175,The aging patriarch of an organized crime dynasty transfers control to his reluctant son.
The Dark Knight,2008,"Action, Crime, Drama",9.0,152,"Batman faces the Joker, a criminal mastermind who plunges Gotham into anarchy."
Pulp Fiction,1994,"Crime, Drama",8.9,154,"The lives of two mob hitmen, a boxer, and others intertwine in tales of violence and redemption."
Forrest Gump,1994,"Drama, Romance",8.8,142,"The presidencies of Kennedy and Johnson, and more, through the eyes of an Alabama man."
